{
	"schema_version": "1.1.0",
	"id": "sg.cpf.cpf-withdrawals-from-55-to-64",
	"kind": "answer",
	"language": "en",
	"translation_of": null,
	"title": {
		"short": "CPF withdrawal",
		"full": "CPF withdrawals from 55 to 64"
	},
	"summary": {
		"text": "From age 55, you can withdraw any OA amount if you have set aside your FRS. Otherwise, you can withdraw $5,000 from your OA.",
		"quote_refs": [
			"q1"
		]
	},
	"details": [
		{
			"heading": "Check your available amount",
			"body": "Log into your Retirement dashboard to check how much CPF savings you can withdraw from age 55.",
			"quote_refs": [
				"q2"
			]
		},
		{
			"heading": "If you have set aside your FRS",
			"body": "If your Full Retirement Sum is set aside fully in cash, or with a mixture of property and cash, you can withdraw any amount from your Ordinary Account.",
			"quote_refs": [
				"q3"
			]
		},
		{
			"heading": "If you have not set aside your FRS",
			"body": "You can withdraw $5,000 from your Ordinary Account. After you withdraw, non-withdrawable OA savings may be transferred to your Retirement Account to help make up your FRS.",
			"quote_refs": [
				"q4"
			]
		}
	],
	"topic": {
		"area": "cpf-and-support",
		"tags": [
			"retirement-income",
			"retirement-withdrawals"
		]
	},
	"search": {
		"example_phrasings": [
			"How much CPF savings can I withdraw from age 55 to 64?",
			"How much CPF can I take out from 55 to 64?",
			"What can I withdraw from my CPF at age 55?",
			"How much can I withdraw from my OA before 65?"
		]
	},
	"sources": [
		{
			"id": "src1",
			"publisher": "CPF",
			"url": "https://ask.gov.sg/cpf/questions/cmd9gg46p00zw36wpnwpy7itj",
			"page_title": "How much CPF savings can I withdraw from age 55 to 64?",
			"source_modified_at": "2025-07-18",
			"retrieved_at": "2026-09-18T15:00:30.941Z"
		}
	],
	"quotes": [
		{
			"id": "q1",
			"source": "src1",
			"text": "The amount that you can withdraw is determined as follows:"
		},
		{
			"id": "q2",
			"source": "src1",
			"text": "You can check the CPF savings you can withdraw from age 55 by logging into your Retirement dashboard."
		},
		{
			"id": "q3",
			"source": "src1",
			"text": "If you have set aside your Full Retirement Sum (FRS), fully in cash or with a mixture of property and cash: You can withdraw any amount from your Ordinary Account (OA)"
		},
		{
			"id": "q4",
			"source": "src1",
			"text": "If you have not set aside your FRS: You can withdraw $5,000 from your OA Upon your withdrawal, non-withdrawable amounts in your OA may be transferred to your Retirement Account (RA) to make up your FRS."
		}
	],
	"provenance": {
		"collected": {
			"method": "sitemap-crawl",
			"at": "2026-09-18T15:00:30.941Z"
		},
		"structured": {
			"method": "model",
			"model": null,
			"prompt_version": "compose-1",
			"at": "2026-09-18T15:00:30.941Z"
		}
	},
	"verification": {
		"status": "grounded",
		"checks": [
			{
				"type": "quotes-found",
				"passed": true,
				"at": "2026-09-18T15:00:30.941Z",
				"note": "checked against https://ask.gov.sg/cpf/questions/cmd9gg46p00zw36wpnwpy7itj as crawled"
			},
			{
				"type": "refs-resolve",
				"passed": true,
				"at": "2026-09-18T15:00:30.941Z"
			}
		]
	},
	"lifecycle": {
		"version": 1,
		"created_at": "2026-09-18T15:00:30.941Z",
		"updated_at": "2026-09-18T15:00:30.941Z"
	}
}
