{
	"schema_version": "1.1.0",
	"id": "sg.cpf.avoiding-cpf-phishing-scams",
	"kind": "process",
	"language": "en",
	"translation_of": null,
	"title": {
		"short": "Avoid phishing",
		"full": "Avoiding CPF phishing scams"
	},
	"summary": {
		"text": "Protect your log-in details, check who contacted you, and inspect links before opening them.",
		"quote_refs": [
			"q1"
		]
	},
	"steps": [
		{
			"position": 1,
			"name": "Protect your log-in details",
			"text": "Do not share your Singpass or bank log-in details. CPF officers will never ask for them.",
			"points": {
				"items": [
					"Do not share your Singpass or bank log-in details.",
					"CPF officers will NEVER ask for your Singpass or bank log-in details."
				]
			},
			"confirm_label": "I protected my details",
			"quote_refs": [
				"q2"
			]
		},
		{
			"position": 2,
			"name": "Check who contacted you",
			"text": "Check that the message came through an official CPF channel. Check that email addresses are spelt correctly.",
			"points": {
				"lead": "CPF Board uses these official channels:",
				"items": [
					"Calls from 6227 1188.",
					"SMSes from \"gov.sg\" sender ID.",
					"Emails ending with @cpf.gov.sg or @e.cpf.gov.sg. Check the spelling.",
					"WhatsApp sender \"CPF Board Text Us\" with the blue badge, phone number 6031 5753."
				]
			},
			"confirm_label": "I checked the sender",
			"quote_refs": [
				"q3"
			]
		},
		{
			"position": 3,
			"name": "Check links before opening",
			"text": "Check the full address of a link before you open it. It should end with “.gov.sg”.",
			"points": {
				"items": [
					"Check that the link’s domain ends with “.gov.sg”.",
					"On a computer, hover over the link to view its full address.",
					"On a mobile device, hold your finger down on the link to see its full address."
				]
			},
			"confirm_label": "I checked the link",
			"quote_refs": [
				"q4"
			]
		},
		{
			"position": 4,
			"name": "Report suspicious messages",
			"text": "Report messages pretending to be from CPF Board through its official hotline or Write to us. If you are unsure, check with the ScamShield app or call 1799.",
			"points": {
				"items": [
					"Report messages spoofing CPF Board via its official hotline or Write to us.",
					"If unsure, check with the ScamShield app or call the 24/7 ScamShield anti-scam helpline via 1799."
				]
			},
			"confirm_label": "I reported or checked",
			"quote_refs": [
				"q5"
			]
		}
	],
	"topic": {
		"area": "scams",
		"tags": [
			"general-information-useful-tips",
			"protection-against-scams",
			"fighting-scams",
			"protecting-your-cpf-account"
		]
	},
	"search": {
		"example_phrasings": [
			"How do I avoid falling prey to phishing scams?",
			"Avoid phishing",
			"How can I spot a CPF phishing message?",
			"How do I check if a CPF message is real?",
			"Avoiding CPF phishing scams"
		]
	},
	"sources": [
		{
			"id": "src1",
			"publisher": "CPF",
			"url": "https://ask.gov.sg/cpf/questions/cmkynucpx0057pnhljog0tvcy",
			"page_title": "How do I avoid falling prey to phishing scams?",
			"source_modified_at": "2026-09-17",
			"retrieved_at": "2026-09-28T17:28:02.297Z"
		}
	],
	"quotes": [
		{
			"id": "q1",
			"source": "src1",
			"text": "Here are some tips on how to protect yourself against phishing scams pretending to come from CPF Board:"
		},
		{
			"id": "q2",
			"source": "src1",
			"text": "Do not share your Singpass or bank log-in details with anyone. CPF officers will NEVER ask for your Singpass or bank log-in details."
		},
		{
			"id": "q3",
			"source": "src1",
			"text": "Check the source of the message. CPF Board will only contact you through these official channels:"
		},
		{
			"id": "q4",
			"source": "src1",
			"text": "Stay vigilant and examine the links embedded in the message. Messages from CPF Board may contain links to Government websites. Before clicking on such links, please check that the domain of the link ends with “.gov.sg” by hovering your mouse over the link to view the full address."
		},
		{
			"id": "q5",
			"source": "src1",
			"text": "Report any suspicious messages spoofing CPF Board via our CPF official hotline or Write to us. If unsure, check with the ScamShield app or call the 24/7 ScamShield anti-scam helpline via 1799."
		}
	],
	"provenance": {
		"collected": {
			"method": "sitemap-crawl",
			"at": "2026-09-28T17:28:02.297Z"
		},
		"structured": {
			"method": "model",
			"model": null,
			"prompt_version": "compose-2",
			"at": "2026-09-28T17:28:02.297Z"
		}
	},
	"verification": {
		"status": "grounded",
		"checks": [
			{
				"type": "quotes-found",
				"passed": true,
				"at": "2026-09-28T17:28:02.297Z",
				"note": "checked against 1 crawled page(s): https://ask.gov.sg/cpf/questions/cmkynucpx0057pnhljog0tvcy"
			},
			{
				"type": "refs-resolve",
				"passed": true,
				"at": "2026-09-28T17:28:02.297Z"
			}
		]
	},
	"lifecycle": {
		"version": 1,
		"created_at": "2026-09-28T17:28:02.297Z",
		"updated_at": "2026-09-28T17:28:02.297Z"
	}
}
