{
	"schema_version": "1.1.0",
	"id": "sg.moh.advertising-healthcare-services-overseas",
	"kind": "answer",
	"language": "en",
	"translation_of": null,
	"title": {
		"short": "Overseas adverts",
		"full": "Advertising healthcare services overseas"
	},
	"summary": {
		"text": "HCSA advertising rules apply to adverts accessible in Singapore. Overseas adverts must follow the laws there.",
		"quote_refs": [
			"q1"
		]
	},
	"details": [
		{
			"heading": "Adverts accessible in Singapore",
			"body": "The advertising rules under HCSA apply when an advert can be accessed by people physically located in Singapore.",
			"quote_refs": [
				"q1"
			]
		},
		{
			"heading": "Adverts in other jurisdictions",
			"body": "If a licensee advertises its services in other jurisdictions, it must follow the laws in those jurisdictions.",
			"quote_refs": [
				"q2"
			]
		}
	],
	"topic": {
		"area": "health",
		"tags": [
			"health-regulation",
			"healthcare-services-act"
		]
	},
	"search": {
		"example_phrasings": [
			"Can a licensee appoint an overseas third-party administrator to advertise healthcare services abroad?",
			"What rules apply to promoting medical tourism?",
			"Can healthcare services be advertised in other countries?"
		]
	},
	"sources": [
		{
			"id": "src1",
			"publisher": "MOH",
			"url": "https://ask.gov.sg/moh/questions/clu6lx3rr00ba314rlkwbbwq0",
			"page_title": "Can a licensee appoint a third-party administrator (based overseas) to advertise its licensable healthcare services in other jurisdictions, i.e. promoting medical tourism?",
			"source_modified_at": "2024-03-25",
			"retrieved_at": "2026-09-19T10:01:15.985Z"
		}
	],
	"quotes": [
		{
			"id": "q1",
			"source": "src1",
			"text": "The rules on advertising under HCSA are aimed at protecting the safety and welfare of patients in Singapore, and hence apply to advertisements that are accessible by persons physically located in Singapore."
		},
		{
			"id": "q2",
			"source": "src1",
			"text": "HCSA licensees that advertise their services in other jurisdictions will have to comply with the prevailing laws in that jurisdiction."
		}
	],
	"provenance": {
		"collected": {
			"method": "sitemap-crawl",
			"at": "2026-09-19T10:01:15.985Z"
		},
		"structured": {
			"method": "model",
			"model": null,
			"prompt_version": "compose-1",
			"at": "2026-09-19T10:01:15.985Z"
		}
	},
	"verification": {
		"status": "grounded",
		"checks": [
			{
				"type": "quotes-found",
				"passed": true,
				"at": "2026-09-19T10:01:15.985Z",
				"note": "checked against 1 crawled page(s): https://ask.gov.sg/moh/questions/clu6lx3rr00ba314rlkwbbwq0"
			},
			{
				"type": "refs-resolve",
				"passed": true,
				"at": "2026-09-19T10:01:15.985Z"
			}
		]
	},
	"lifecycle": {
		"version": 1,
		"created_at": "2026-09-19T10:01:15.985Z",
		"updated_at": "2026-09-19T10:01:15.985Z"
	}
}
