{
	"schema_version": "1.1.0",
	"id": "sg.moh.applying-for-comcare-after-sirs-refund",
	"kind": "process",
	"language": "en",
	"translation_of": null,
	"title": {
		"short": "ComCare help",
		"full": "Applying for ComCare after SIRS refund"
	},
	"summary": {
		"text": "You can apply if your household cannot afford basic living expenses. Contact an MSF Social Service Office.",
		"quote_refs": [
			"q1"
		]
	},
	"steps": [
		{
			"position": 1,
			"name": "Contact an SSO",
			"text": "If your household cannot afford basic living expenses, email Ask_SSO@msf.gov.sg, call 1800-222-0000, or approach the nearest Social Service Office.",
			"confirm_label": "I contacted an SSO",
			"quote_refs": [
				"q2"
			]
		}
	],
	"topic": {
		"area": "health",
		"tags": [
			"comcare",
			"covid-19-related-queries"
		]
	},
	"search": {
		"example_phrasings": [
			"Can I apply for ComCare assistance if I have refunded my SIRS payout?",
			"Can I get ComCare after returning SIRS money?",
			"How do I apply for ComCare after a SIRS refund?"
		]
	},
	"sources": [
		{
			"id": "src1",
			"publisher": "MOH",
			"url": "https://ask.gov.sg/moh/questions/cls1lenkh01z5jzsgl7qj43ph",
			"page_title": "Can I apply for ComCare assistance if I have refunded my SIRS payout?",
			"source_modified_at": "2024-11-21",
			"retrieved_at": "2026-09-19T10:02:21.140Z"
		}
	],
	"quotes": [
		{
			"id": "q1",
			"source": "src1",
			"text": "Low-income households that are unable to afford their basic living expenses can approach MSF’s Social Service Offices (SSOs) to apply for ComCare."
		},
		{
			"id": "q2",
			"source": "src1",
			"text": "If you need financial assistance, you may email Ask_SSO@msf.gov.sg, call the ComCare hotline at 1800-222-0000, or approach the nearest Social Service Office."
		}
	],
	"provenance": {
		"collected": {
			"method": "sitemap-crawl",
			"at": "2026-09-19T10:02:21.140Z"
		},
		"structured": {
			"method": "model",
			"model": null,
			"prompt_version": "compose-1",
			"at": "2026-09-19T10:02:21.140Z"
		}
	},
	"verification": {
		"status": "grounded",
		"checks": [
			{
				"type": "quotes-found",
				"passed": true,
				"at": "2026-09-19T10:02:21.140Z",
				"note": "checked against 1 crawled page(s): https://ask.gov.sg/moh/questions/cls1lenkh01z5jzsgl7qj43ph"
			},
			{
				"type": "refs-resolve",
				"passed": true,
				"at": "2026-09-19T10:02:21.140Z"
			}
		]
	},
	"lifecycle": {
		"version": 1,
		"created_at": "2026-09-19T10:02:21.140Z",
		"updated_at": "2026-09-19T10:02:21.140Z"
	},
	"action": {
		"type": "call",
		"label": "Call 18002220000",
		"value": "18002220000",
		"quote_refs": [
			"q2"
		]
	}
}
