{
	"schema_version": "1.1.0",
	"id": "sg.moh.checking-careshield-life-cover",
	"kind": "process",
	"language": "en",
	"translation_of": null,
	"title": {
		"short": "CareShield cover",
		"full": "Checking CareShield Life cover"
	},
	"summary": {
		"text": "Log in to My Policy with Singpass to find out if you are covered under CareShield Life.",
		"quote_refs": [
			"q1"
		]
	},
	"steps": [
		{
			"position": 1,
			"name": "Log in",
			"text": "Log in to My Policy using your Singpass.",
			"confirm_label": "I have logged in",
			"quote_refs": [
				"q2"
			]
		},
		{
			"position": 2,
			"name": "Check your cover",
			"text": "Find out if you are covered under CareShield Life.",
			"confirm_label": "I checked my cover",
			"quote_refs": [
				"q3"
			]
		}
	],
	"topic": {
		"area": "health",
		"tags": [
			"careshield-life"
		]
	},
	"search": {
		"example_phrasings": [
			"How can I find out if I am covered under CareShield Life?",
			"How do I check my CareShield Life cover?",
			"Am I covered under CareShield Life?"
		]
	},
	"sources": [
		{
			"id": "src1",
			"publisher": "MOH",
			"url": "https://ask.gov.sg/moh/questions/clpjhuuoj003mhipnuybzyfeg",
			"page_title": "How can I find out if I am covered under CareShield Life?",
			"source_modified_at": "2025-08-27",
			"retrieved_at": "2026-09-18T15:02:12.757Z"
		}
	],
	"quotes": [
		{
			"id": "q1",
			"source": "src1",
			"text": "You can log in to My Policy using your Singpass to find out if you are covered under CareShield Life."
		},
		{
			"id": "q2",
			"source": "src1",
			"text": "You can log in to My Policy using your Singpass"
		},
		{
			"id": "q3",
			"source": "src1",
			"text": "find out if you are covered under CareShield Life"
		}
	],
	"provenance": {
		"collected": {
			"method": "sitemap-crawl",
			"at": "2026-09-18T15:02:12.757Z"
		},
		"structured": {
			"method": "model",
			"model": null,
			"prompt_version": "compose-1",
			"at": "2026-09-18T15:02:12.757Z"
		}
	},
	"verification": {
		"status": "grounded",
		"checks": [
			{
				"type": "quotes-found",
				"passed": true,
				"at": "2026-09-18T15:02:12.757Z",
				"note": "checked against https://ask.gov.sg/moh/questions/clpjhuuoj003mhipnuybzyfeg as crawled"
			},
			{
				"type": "refs-resolve",
				"passed": true,
				"at": "2026-09-18T15:02:12.757Z"
			}
		]
	},
	"lifecycle": {
		"version": 1,
		"created_at": "2026-09-18T15:02:12.757Z",
		"updated_at": "2026-09-18T15:02:12.757Z"
	}
}
